ID,Corporate Debtor,Resolution Professional,Date,Status,Form G Link,Scraped At
assign_1780635537635_1,PRAYAG POLYTECH PRIVATE LIMITED (TRANSFER FROM DELHI TO RAJASTHAN),Mr. Rishabh Chand Lodha,"07th July, 2026",Active,https://ibbi.gov.in//uploads/resolution_plan/26853e706d57b0bf7b4b317cd1944492.pdf,2026-06-05T04:58:57.635Z
assign_1780635537636_2,Odicea Distribution Technologies Private Limited,Neha Jain Nemani,"23rd June, 2026",Active,https://ibbi.gov.in//uploads/resolution_plan/2026-06-04-162955-c09zq-cf4486d907903e6840ad00c0311872be.pdf,2026-06-05T04:58:57.636Z
assign_1780635537636_3,SUMERU BUILDCON PRIVATE LIMITED,Mr. Srigini Rajat Naidu,"29th June, 2026",Active,https://ibbi.gov.in//uploads/resolution_plan/3c623885705fc8bdfcc2bb3d31262205.pdf,2026-06-05T04:58:57.636Z
assign_1780635537636_4,REPUTE FOODS PRIVATE LIMITED,Mr. Chirag Rajendra Kumar Shah,"19th June, 2026",Active,https://ibbi.gov.in//uploads/resolution_plan/2026-06-03-170328-vl6dr-ac9e77b439fd276b50a412f24d29b33a.pdf,2026-06-05T04:58:57.636Z
assign_1780635537636_5,NIRMAL LIFESTYLE LIMITED,Mr. Birendra Kumar Agrawal,"26th June, 2026",Active,https://ibbi.gov.in//uploads/resolution_plan/5777602cf9d45fc536ceecebb96954ed.pdf,2026-06-05T04:58:57.636Z
assign_1780635537637_6,LET'S JUMP TRAMPOLINE AND ADVENTURE PRIVATE LIMITED,Mr. Atul Mittal,"19th June, 2026",Active,https://ibbi.gov.in//uploads/resolution_plan/2026-05-29-112329-ev217-e15b6c5129705e8d3ec0307b22a2305d.pdf,2026-06-05T04:58:57.637Z
assign_1780635537637_7,KRISTAL PROJECTS (INDIA) LIMITED,Nilesh Kothari,"26th June, 2026",Active,https://ibbi.gov.in//uploads/resolution_plan/2026-06-02-162459-45oky-40dfe58fc60c19df8a2e008b665901d0.pdf,2026-06-05T04:58:57.637Z
assign_1780635537637_8,JALDHAKA COLD STORAGE PRIVATE LIMITED,Chandradeep Kumar,"26th June, 2026",Active,https://ibbi.gov.in//uploads/resolution_plan/8b9b2a4a0d4994b8293a796ba63735e6.pdf,2026-06-05T04:58:57.637Z
assign_1780635537637_9,STEELEXPERT INDUSTRIES (INDORE) PRIVATE LIMITED,Anuj Maheshwari,"25th June, 2026",Active,https://ibbi.gov.in//uploads/resolution_plan/44301f153a9141c903bf39ef8c3934bc.pdf,2026-06-05T04:58:57.637Z
assign_1780635537637_10,ALKA VENTURES PRIVATE LIMITED,Mr. Jasin Jose,"22nd June, 2026",Active,https://ibbi.gov.in//uploads/resolution_plan/868b8ee0f7334a822e361667ece5d229.pdf,2026-06-05T04:58:57.637Z
assign_1780635537637_11,SHRI BHAGWATI AGRO INDUSTRIES PRIVATE LIMITED,Ms. Teena Saraswat Pandey,"20th June, 2026",Active,https://ibbi.gov.in//uploads/resolution_plan/f8c16e3dbacc13a7823ca8d77f531eea.pdf,2026-06-05T04:58:57.637Z
assign_1780635537637_12,HARIDWAR HIGHWAYS PROJECT LIMITED,Mr. Alok Kumar Agarwal,"16th June, 2026",Active,https://ibbi.gov.in//uploads/resolution_plan/2026-06-03-100057-4vlti-9a9422f9685129ebd40257968bbe536a.pdf,2026-06-05T04:58:57.637Z
assign_1780635537637_13,N KUMAR HOUSING &amp; INFRASTRUCTURE PRIVATE LIMITED,Mr. Jayesh Natvarlal Sanghrajka,"16th June, 2026",Active,https://ibbi.gov.in//uploads/resolution_plan/2026-05-28-131521-pzstk-77489d7cbc653b5f7e7085e218bec5f4.pdf,2026-06-05T04:58:57.637Z
assign_1780635537638_14,GREEN BELT INDUSTRY PRIVATE LIMITED,NEHA AGARWAL,"20th June, 2026",Active,https://ibbi.gov.in//uploads/resolution_plan/3e09456994e4da18bc55c3d4f5878ee8.pdf,2026-06-05T04:58:57.638Z
assign_1780635537638_15,HEERA-IND TRADING PRIVATE LIMITED,Mr. Mahesh Goverdhan Bagla,"20th June, 2026",Active,https://ibbi.gov.in//uploads/resolution_plan/2444475068456ff7556fe484fefc3952.pdf,2026-06-05T04:58:57.638Z
assign_1780635537638_16,PALLISHREE LTD,Mr. Neeraj Jain,"20th June, 2026",Active,https://ibbi.gov.in//uploads/resolution_plan/2026-05-27-123253-dnzu5-e2cf4d686357e7683c439edfb22f89d3.pdf,2026-06-05T04:58:57.638Z
assign_1780635537638_17,GREEN BELT INDUSTRY PRIVATE LIMITED,NEHA AGARWAL,"20th June, 2026",Active,https://ibbi.gov.in//uploads/resolution_plan/2026-05-30-132255-548ga-dae0f38a8c2ebcbf08197ad5c0d4de12.pdf,2026-06-05T04:58:57.638Z
assign_1780635537638_18,GAJANAN PAPER MILLS PRIVATE LIMITED,Mr. Mahendra Prasad Jindal,"11th June, 2026",Active,https://ibbi.gov.in//uploads/resolution_plan/2026-05-30-211112-fa6ku-20ce1a80ae87776e696ef49dcacfca27.pdf,2026-06-05T04:58:57.638Z
assign_1780635537638_19,SONI SOYA PRODUCTS LIMITED,Harsh Firoda,"11th June, 2026",Active,https://ibbi.gov.in//uploads/resolution_plan/3412858a819c3b5563e24f627f73560c.jpg,2026-06-05T04:58:57.638Z
assign_1780635537638_20,KHUSHBOO MARBLES PVT LTD,UMANG JAIN,"13th June, 2026",Active,https://ibbi.gov.in//uploads/resolution_plan/159672ce4bf464424807d21c18c1306e.pdf,2026-06-05T04:58:57.638Z